text,chunk_type,section_name,start_pos,end_pos,word_count,grant_id,document_title,year,institute,is_fqhc_focused,fqhc_score,data_source,primary_condition,chunk_id,contains_methods,contains_outcomes,contains_innovation
"approach to specifically focus on the transcriptional regulation of MN subtype-specific terminal identity genes. The goal of this proposal is to uncover conserved, gene regulatory mechanisms that establish during development, and maintain throughout life, the expression of MN subtype-specific terminal features. To this end, this proposal combines the strengths of two model organisms: the nematode Caenorhabditis elegans and mouse Mus musculus. By studying how C. elegans ventral nerve cord (VNC) MNs acquire their subtype-specific features, we discovered a gene regulatory mechanism that involves the intersectional activity of highly conserved transcription factors. We found that the transcription factor UNC-3 induces and maintains the expression of terminal identity genes in all VNC MN subtypes. However, UNC-3 does not act alone. It requires co-factors in the form of Hox proteins that act synergistically with UNC-3 to activate expression of terminal identity genes in distinct MN subtypes along the anterior-posterior axis of the VNC. We observed Hox expression in developing and adult MNs, suggesting that Hox proteins, similar to UNC-3, not only induce, but also maintain expression of terminal identity genes. The unpublished data in this application indicate that Hox proteins, in mice, also control expression of terminal identity genes in spinal MNs, suggesting evolutionary conservation of our C. elegans findings. This proposal aims to uncover the function of Hox proteins in adult C. elegans MNs (Aim 1), decipher the gene regulatory mechanisms downstream of Hox in C. elegans MNs (Aim 2), and test the hypothesis that a mouse Hox protein (Hoxc8), similar to its C. elegans orthologs, is required to induce and maintain expression of terminal identity genes in MNs of the brachial spinal cord (Aim 3). Completion of the proposed activities will advance our understanding of how distinct MN subtypes become and remain functional, which may provide new insights into the etiology, diagnosis, and treatment of MN disorders.",section,approach,827.0,2867.0,306,5R01NS116365-04,Hox-dependent mechanisms for establishment and maintenance of motor neuron terminal identity,2023,,False,0.0,phase2_nih,,5R01NS116365-04_chunk210,,,
method exists to accurately translate cerebral blood flow or metabolic data from animal to human. For lack of rigorous mathematical,section,methods,201.0,333.0,20,1R01AG079894-01,Image-based cerebrovascular network snythesis(iCNS) to model Alzheimer's Disease,2023,,False,0.0,phase2_nih,,1R01AG079894-01_chunk211,,,
"methods for cerebral metabolic parameters between species, translation of valuable research data from mouse to human remains guesswork. There is a need for a predictive computational framework that quantifies cerebral blood flow and metabolism in normal and diseased human brain states. Our long term goal is to quantify fundamental physiological processes of aging and Alzheimer’s disease (AD), so that their effects can be slowed or even partially reversed. The objective is to expand the utility of MRI analysis by magnifying the detectability of age-related microcirculatory changes in humans with a mechanistic mathematical framework. It is our hypothesis that age and AD related changes in the microcirculation also generate macroscopic perturbations of hemodynamic and/or oxygen perfusion states that will be detectable with advanced MRI techniques, when guided by rigorous brain simulations over all relevant length scales. The rationale is that critical physiological metrics for dysfunction in aged brains (=aging biomarkers) will be exposed by systematic exploration and simulation of fundamental hemodynamic and metabolic processes. The central hypothesis will be tested by pursuing three",section,methods,333.0,1534.0,172,1R01AG079894-01,Image-based cerebrovascular network snythesis(iCNS) to model Alzheimer's Disease,2023,,False,0.0,phase2_nih,,1R01AG079894-01_chunk212,,,
"specific aims: Aim 1) Assess the predictive value of mechanistic modeling by simulating the link between capillary stalling, vascular tracer transit properties, and tissue oxygen delivery, and validate predictions using advanced microscopic imaging in mouse. We determine the effects of aging and AD in aged rodent brains. Aim 2) Develop mechanistic multiscale model for predicting the impact of cerebral perfusion on oxygen metabolism in the human cortex under normal and pathological conditions. Anatomically detailed mechanistic models of cerebral circulation in human will predict the effect of structural and functional changes in AD on oxygen extraction in the human brain with MRI. Aim 3) Assess the predictive value of mechanistic multiscale modeling to quantify microvascular properties across the human brain cortex in health and disease using advanced MRI. To validate the mechanistic translation from mouse to human, we will measure age-related metabolic functions in cohorts of aged and Alzheimer patients. We identify hemodynamic and metabolic metrics (=biomarkers) that correlate with cognitive decline This contribution is significant because it will predict how changes in vascular morphometry and metabolism lead to neurological decline. It will identify biomarkers visible in noninvasive diagnostic imaging in humans that signal age-related deterioration before symptoms develop. The mechanistic framework relating data acquired in mouse to human will dramatically boost the relevance of animal data for human medicine.",section,specific_aims,1534.0,3072.0,219,1R01AG079894-01,Image-based cerebrovascular network snythesis(iCNS) to model Alzheimer's Disease,2023,,False,0.0,phase2_nih,,1R01AG079894-01_chunk213,,,
"Severe acute respiratory syndrome coronavirus-2 (SARS-CoV-2) is responsible for the current pandemic of coronavirus-induced disease 2019 (COVID-19).

Since December 2019, coordinated research efforts have provided a wealth of critical data that have enhanced our ability to diagnose and treat COVID-19.

To date, however, much of the molecular and cellular mechanisms underlying the pathogenesis of COVID-19 remain elusive.

The genome of SARS-CoV-2 contains nine independent open reading frames (ORFs) coding for proteins that are not essential for viral replication but seem to exert important functions in modulating host antiviral immunity.

Of these accessory proteins, the ORF8 protein stands out for its unique characteristics.

ORF8 is a highly variable protein among SARS-related CoVs.

ORF8 also appears to be involved in a network of host-pathogen interactions inside infected cells: ORF8 impairs immune pathways such as antigen presentation, interferon type I, and nuclear factor-kB, as well as possibly activate growth pathways.

A central question is how ORF8 mediates interactions with multiple host protein targets.

Towards this goal, we are investigating ORF8 interaction with major histocompatibility class I (MHC I) molecules.

It was shown recently that SARS-CoV-2 ORF8 suppresses CD8+ T cell responses by downregulating MHC I molecules, both in vitro and in vivo.

We hypothesize that ORF8 suppresses surface expression of HLA-A and HLA-B molecules to protect infected cells from recognition by CD8+ T cells, but spares HLA-C and HLA-E to avoid activation of natural killer (NK) cells.",results,semantic_chunk,,,234,1R21AI173863-01,Immune evasion by SARS-CoV-2: the role of HLA class I,2023,,False,0.0,phase2_nih,,1R21AI173863-01_chunk214,False,False,False
"The possibility that ORF8 displays a locus specificity toward MHC I would provide a mechanism for SARS-CoV-2 to walk a fine line between adaptive and innate immunity.

Specifically, we will undertake an analysis of interactions between ORF8 and MHC I by using a panel of HLA- A, -B, -C, and -E molecules, and also determine if ORF8 selectively downregulates MHC I in relevant cell systems (Aim 1).

We will extend these studies to ORF8 variants that have been positively selected during the course of the pandemic and evaluate if and how these mutations affect MHC I binding and downregulation (Aim 2).

The successful completion of these Aims is expected to uncover unknown features of ORF8 and elucidate its role in suppressing antigen presentation, as well as inform us on the selective pressure that MHC I exerts on SARS-CoV-2.

The immediate and long-term impact of our proposed research is high.

This is the first study that: (1) characterizes molecular interaction of ORF8 with a host protein; and (2) evaluates clinically relevant ORF8 variants.

By studying the immune interactions underlying ORF8-mediated downregulation of MHC I, we will increase our understanding of how SARS-CoV-2 derails cellular immunity.

Importantly, our study will stimulate similar investigations of other ORF8-interactors, providing novel opportunities for the development of therapeutics directed against ORF8 or its host targets.",aims,semantic_chunk,,,219,1R21AI173863-01,Immune evasion by SARS-CoV-2: the role of HLA class I,2023,,False,0.0,phase2_nih,,1R21AI173863-01_chunk215,False,False,True
"results are supported by strong in vivo murine data that suggests antiviral efficacy and topical dosage safety of Na-PBA. Due to the high sodium burden associated with Na-PBA administration, its unpalatability, and inability to penetrate sufficiently through corneal epithelium upon topical administration, we have developed various sodium-free PBA nanoformulations to overcome limitations associated with oral and topical delivery of Na-PBA. The purpose of this R24 application is to generate preclinical data in two animal models that support an IND application for repurposing PBA to treat ocular HSV infection. This will be achieved via 3 well thought, exhaustive",section,results,1256.0,1924.0,97,5R24EY033598-02,Alleviation of ER stress as a translational strategy to curb ocular viral infections,2023,,False,0.0,phase2_nih,,5R24EY033598-02_chunk216,,,
"specific aims. In the first aim, we will evaluate dose-dependent pharmacokinetics, and safety of orally and topically delivered Na-PBA solution and various sodium-free PBA nanoformulations. Furthermore, we will also determine oral and topical, and oral antiviral efficacy of Na-PBA and sodium-free PBA nanoformulations in murine models of ocular HSV-1 infection. The second aim will use the most effective oral and topical formulation(s) and test their safety, PK, and efficacy in guinea pig and rabbit models of primary and reactivated ocular HSV-1 infection. Finally aim 3, we will investigate the potential of Na-PBA and sodium-free PBA formulations to synergize with existing antiviral therapies to determine their potential as an add-on modality to the existing treatment. The latter is likely and significant since PBA is a rare drug that works via alleviating ER stress and aiding the host cell’s response to viral infection, and thereby reducing the chance for emergence of viral resistance. We have assembled a multidisciplinary team including scientists, clinicians, drug development and translation experts who can help us navigate through requisite FDA guidelines. PBA has the potential to become a safe and efficacious alternative to existing ocular antivirals very quickly.",section,specific_aims,1924.0,3211.0,191,5R24EY033598-02,Alleviation of ER stress as a translational strategy to curb ocular viral infections,2023,,False,0.0,phase2_nih,,5R24EY033598-02_chunk217,,,
"approaches with advanced quantitative imaging of cytoskeletal dynamics and biophysical measurements. By obtaining kinetic and kinematic (motion) signatures of proteins at varying levels of tension, we identify mechanisms of force transmission within focal adhesions and the actin cytoskeleton. We then collaborate closely with theoretical physicists to test the predictions of analytical theory and simulations with our quantitative biophysical measurements. This work builds a biophysical understanding of cell adhesion, tension and shape that, ultimately, will provide the framework for theories and models of tissue morphogenesis that will have predictive power in understanding in complex physiological processes. More generally, the strategies developed in this proposal can be applied more generally to understand how force-sensitive feedbacks within the cytoskeletal conspire to facilitate cell morphogenic processes. This will enable the development of improved therapies to treat diseases involved in tissue homeostasis that currently remain elusive by solely treating molecular targets.",section,approach,1412.0,2508.0,146,5R01GM104032-08,Mechanical Regulation of Cell Adhesion by Dynamic Cytoskeletal Assemblies,2023,,False,0.0,phase2_nih,,5R01GM104032-08_chunk218,,,
"results from our group and others have established a complementary paradigm: temperature acts as a physiological signal, triggering the adaptive formation of biomolecular condensates with specific cellular functions, and the condensation process is regulated by heat shock proteins. Crucially, in the proteotoxic model, aggregates are trash, but in the adaptive condensation model, they are functional treasure. Using an integrated set of biochemical, cell biological, and evolutionary",section,results,318.0,804.0,66,5R35GM144278-02,Function and Regulation of Stress-Induced Adaptive Condensates,2023,,False,0.0,phase2_nih,,5R35GM144278-02_chunk219,,,
"approaches established over the past decade, we are pursuing three linked areas: 1) identifying and dissecting the cellular functions of particular heat-shock and stress-induced condensates of protein and mRNA; 2) studying the regulation of condensation and dispersal, focusing on the specificity of physiological condensates and their remodeling and reversal by stress-induced molecular chaperones; and 3) probing the sensation and transduction of temperature into adaptive responses in fungi which rely on warm-blooded hosts for growth or dispersal, and in the temperature-dependent activation of cells in the vertebrate immune system during fever. In addition to fundamental insights into the operation and organization of eukaryotic cells, these studies promise to shed light on intracellular aggregation processes known to be dysregulated during neurodegenerative disease, uncover new mechanisms for the control of fungi, and provide new molecular insight into how fever promotes immune-cell activation.",section,approach,804.0,1812.0,139,5R35GM144278-02,Function and Regulation of Stress-Induced Adaptive Condensates,2023,,False,0.0,phase2_nih,,5R35GM144278-02_chunk220,,,
"approaches on health outcomes, and addressing cancers relevant to our catchment area. Underpinning each of these initiatives is computation-based models for cancer research and care.",section,approach,2917.0,3099.0,25,3P30CA014599-47S3,Cancer Center Support Grant,2023,,False,0.0,phase2_nih,,3P30CA014599-47S3_chunk221,,,
"The prevalence of food allergy has experienced an unprecedented increase in Western societies, rising by as much as 20% in a recent ten-year period.

We have previously described a role for mucosa- associated commensal bacteria in protection from allergic sensitization in mice.

To understand how the microbiota regulates allergic disease in humans, we colonized germ free mice with human bacteria from the feces of healthy or cow’s milk allergic (CMA) infants.

Our data shows that colonization with bacteria derived from healthy human infant feces is sufficient to protect mice against sensitization to the cow’s milk allergen b-lactoglobulin (BLG), whereas colonization with feces from human CMA infants fails to protect.

By analyzing operational taxonomic units (OTUs) differentially abundant between our human fecal donors (4 healthy, 4 CMA) we have defined a microbial signature that distinguishes the CMA and heathy populations in both the human donors and the colonized mice, emphasizing the clinical relevance of our gnotobiotic model.

RNASeq analysis of ileal intestinal epithelial cells revealed differentially expressed genes (DEGs) that distinguished healthy- and CMA-colonized mice across all donors.

Correlation of ileal OTUs with DEGs in the ileum of healthy-colonized mice identified a Clostridial species, Anaerostipes caccae, that protected against an allergic response to food.

Our findings demonstrate a causal role for the healthy infant microbiota in protection against food allergy and suggest that interventions that modulate bacterial communities may inform the development of novel therapeutic strategies for this disease.",results,semantic_chunk,,,238,5R01AI146099-04,Mechanisms by which intestinal bacteria contribute to maintenance of tolerance in food allergy,2023,,False,0.0,phase2_nih,,5R01AI146099-04_chunk222,False,False,True
"In this proposal we will further refine our OTU signature and examine whether the CMA infant microbiome is an atopic microbiome in Aim 1.

Aim 2 will explore how healthy intestinal bacteria influence the response to food allergens by examining their impact on innate lymphoid cell function, early T/B priming and effector T cell differentiation and migration.

The robust, pre-clinical gnotobiotic models we describe will provide an ideal system in which to identify key host-microbial interactions that contribute to the maintenance of tolerance to dietary antigen in food allergy.",aims,semantic_chunk,,,89,5R01AI146099-04,Mechanisms by which intestinal bacteria contribute to maintenance of tolerance in food allergy,2023,,False,0.0,phase2_nih,,5R01AI146099-04_chunk223,False,False,False
"resulting in declining REACH (percent of at-risk youth who complete intervention). To prepare for implementation studies and dissemination, we need to address adolescent tolerability and practice/health system scalability, while preserving efficacy. Multiphase Optimization Strategy (MOST) uses a systematic analytic",section,results,1174.0,1491.0,39,5R01MH124723-03,Primary Care Based Depression Prevention in Adolescents: Intervention Optimization in Preparation for Implementation Study,2023,,False,0.0,phase2_nih,,5R01MH124723-03_chunk224,,,
"approach and a factorial randomized clinical trial design to address efficacy, tolerability, and scalability, simultaneously. We will use a MOST",section,approach,1491.0,1636.0,20,5R01MH124723-03,Primary Care Based Depression Prevention in Adolescents: Intervention Optimization in Preparation for Implementation Study,2023,,False,0.0,phase2_nih,,5R01MH124723-03_chunk225,,,
"approach to optimize CATCH-IT for the prevention of depression (indicated prevention, i.e., elevated symptoms of depression) in practices and health systems representative of US geography and population. The theoretically grounded components of CATCH-IT selected for study and optimization are: behavioral activation, cognitive therapy, interpersonal psychotherapy, and parent program. We will use a 4-factor (2x2x2x2) fully crossed factorial design with N=16 cells (20 per cell, 15% dropout) to evaluate the contribution of each component. We propose to randomize N=378 (N=189) from each health system site. The at-risk youth will be high school students 13 through 18 years old, not currently experiencing a mood disorder, but with subsyndromal symptoms of depression (moderate to high risk). Using the efficient factorial design, we can assess the contribution to prevention efficacy of each component. Thus, the MOST study design will enable us to eliminate non-contributing components while preserving efficacy and to optimize CATCH-IT by strengthening tolerability and scalability by reducing “resource use.” By reducing resource use, we anticipate satisfaction and acceptability will also increase, preparing the way for an implementation trial and eventual US Preventive Services Task Force endorsement to support dissemination. Thus, our primary question is whether one component, or perhaps two, can demonstrate an equivalent effect to combinations of other components in terms of efficacy, whilst also demonstrating superior adolescent/family tolerability scalability over a 12-month follow-up.",section,approach,1636.0,3241.0,223,5R01MH124723-03,Primary Care Based Depression Prevention in Adolescents: Intervention Optimization in Preparation for Implementation Study,2023,,False,0.0,phase2_nih,,5R01MH124723-03_chunk226,,,
"results suggest that dynein and the Ndc80 complex synergize for efficient chromosome capture and for stabilizing kMT attachments during metaphase, but the mechanism for this coordination is unclear. The centromere-distal region of the Ndc80 complex at the N-terminal domain of the Hec1 subunit has been identified as the MT-binding site required to stabilize kMT attachments. Phosphorylation of this region by Aurora B kinase negatively regulates the strength of kMT attachments. Our work has discovered that in addition to the N-terminal domain, the more internal loop domain has a major role in attachment. The attachment requires the loop domain-mediated kinetochore recruitment of the replication licensing protein Cdt1, which we find is a novel MT-binding protein at kinetochores. Our work also demonstrates that the binding of Cdt1 to MTs is negatively regulated by Aurora B. Our unpublished studies demonstrate that Cdt1 synergizes with another MT-associated protein (MAP) at kinetochores, the Ska complex that has been shown to promote efficient binding of the Ndc80 complex to kMTs. Our 2nd major goal is to determine how different kinetochore MAPs mediate robust interaction between the Ndc80 complex and MTs for the stabilization of kMT attachments during metaphase to drive accurate chromosome segregation. In the long term, our lab aims to identify novel mechanisms controlling kMT attachments and the pathways that regulate this process, while also establishing novel model systems and",section,results,1545.0,3045.0,225,5R01GM135391-05,Molecular mechanisms controlling kinetochore-microtubule attachments during mitosis,2024,,False,0.0,phase2_nih,,5R01GM135391-05_chunk227,,,
"Heart failure (HF) is a major health epidemic in developed countries, however, its underlying pathology is not well characterized.

Tristetraprolin (TTP) is a tandem zinc finger protein that binds to AU-rich elements (ARE) in the 3’-untranslated region (UTR) of target mRNA molecules, and induces their degradation.

Global TTP knockout (KO) mice display systemic inflammation, since TNFα mRNA is normally degraded by TTP, and deletion of TTP leads to elevated TNFα levels.

Thus, very few studies have assessed the role of TTP in metabolism despite its original discovery as an insulin-inducible gene, and genetic studies linking TTP to metabolic syndrome.

We are addressing this fundamental gap in knowledge, and our strong preliminary data suggest critical activities by TTP in cardiac metabolism and the development of HF.

Specifically, we have shown that TTP inhibits fatty acid (FA) and branched-chain amino acid (BCAA) metabolism (independent of its effects on inflammation), and reduces the mRNA levels of key proteins in these processes, i.e., peroxisome proliferator-activated receptor (PPAR)-α and branched-chain α–ketoacid acid dehydrogenase complex (BCKDC)-E2 subunits.

The central hypothesis of this proposal is that TTP inhibits cardiac FA and BCAA metabolism by binding to and degrading PPARα and BCKDC-E2 mRNAs, and that TTP exacerbates the development of HF by impairing FA and BCAA metabolism.

In Aim 1, we will assess whether TTP inhibits cardiac FA metabolism by binding to PPARα mRNA and promoting its degradation.",results,semantic_chunk,,,230,5R01HL155953-03,Role of mRNA-binding protein tristetraprolin in cardiac mRNA regulation and the development of heart failure,2024,,False,0.0,phase2_nih,,5R01HL155953-03_chunk228,False,False,False
"We will assess whether TTP binds to PPARα mRNA by performing RNA co-immunopreciptation (co-IP) and deletion studies of PPARα 3’-UTR AREs.

We will also measure FA uptake and metabolism in the hearts from cardiac-specific TTP KO (csTTP-KO) mice, and will determine whether these changes are through PPARα using TTP/PPARα double KO mice.

In Aim 2, we will determine whether TTP decreases BCAA catabolism through binding and degradation of BCKDC-E2 mRNA.

We will first determine whether TTP binds BCKDC-E2 mRNA by performing RNA co-IP and deletion studies on BCKDC-E2 3’-UTR AREs.

We will also measure BCAA levels and BCKDC activity in heart tissue from csTTP-KO mice.

To demonstrate whether the reduction in BCAA catabolism with TTP KO is through BCKDC-E2, we will perform similar studies with knockdown of TTP and BCKDC-E2.

In Aim 3, we will determine whether TTP has detrimental effects on the heart under stress conditions, and whether this depends upon impaired FA and BCAA metabolism.

We will subject csTTP-KO mice to pressure overload and ischemia, then assess their cardiac function and metabolism.

To determine the role of PPARα and BCKDC in this process, we will use csTTP/PPARα double KO mice and will cross csTTP-KO with protein phosphatase 2Cm KO mice (which have reduced BCKDC activity), and assess cardiac response to stress.

We will also show our studies to develop novel drugs that target TTP without inducing inflammation, providing potential clinical implications for Aim 3.",aims,semantic_chunk,,,236,5R01HL155953-03,Role of mRNA-binding protein tristetraprolin in cardiac mRNA regulation and the development of heart failure,2024,,False,0.0,phase2_nih,,5R01HL155953-03_chunk229,False,False,True
