text,chunk_type,section_name,start_pos,end_pos,word_count,grant_id,document_title,year,institute,is_fqhc_focused,fqhc_score,data_source,primary_condition,chunk_id,contains_methods,contains_outcomes,contains_innovation
"Because of the high mortality, morbidity, and health care costs associated with critical illness, identifying biological mechanisms that can be targeted to improve critical illness outcomes is an important public health priority.

Glucocorticoid treatment has been frequently studied in critically ill populations and can improve short- term survival as well as long-term mental health outcomes.

Full realization of the therapeutic potential of glucocorticoids in critical illness is hampered by gaps in our understanding of its mechanisms of action and by glucocorticoid resistance, which limits its efficacy.

Our future research program will focus on the theme of glucocorticoid mechanisms relevant to critical illness, with three main objectives.

First, our prior work led us to hypothesize that glucocorticoids improve mental health outcomes by enhancing factual memories from the ICU.

We will test this hypothesis in a population of sepsis survivors from our hospital.

Second, we propose a novel hypothesis about the importance of brainstem glucocorticoid signaling in the maintenance of cardiovascular and immune homeostasis.

We will test the role of glucocorticoid receptors in this specific brainstem area in the response to acute hypotensive and inflammatory challenges using the tools and skills that we have acquired for neural circuit interrogation.

Finally, we propose to test a novel strategy to improve peripheral and central glucocorticoid sensitivity in collaboration with a new industry partner.

Over the past five years I have positioned myself as a multidisciplinary leader across critical care, endocrinology, and neuroscience.",results,semantic_chunk,,,238,1R35GM154671-01,Glucocorticoids in short- and long-term critical illness outcomes,2024,,False,0.0,phase2_nih,,1R35GM154671-01_chunk113,False,True,True
"My laboratory’s experience in running a translational research program at this interface will lead to the identification of specific, targetable mechanisms to improve critical illness outcomes.

Alongside these research goals, I will continue my work as a mentor for the next generation of scientists and physician-scientists.

Because of the translational importance of our work and the inclusivity of our environment, my lab has become a sought-after environment for scientific trainees.

During this funding period I will continue to grow as a mentor and leader, cultivating a collaborative and diverse group that reflects and prepares the next generation of scientists.",results,semantic_chunk,,,99,1R35GM154671-01,Glucocorticoids in short- and long-term critical illness outcomes,2024,,False,0.0,phase2_nih,,1R35GM154671-01_chunk114,False,True,False
".

Chronic pelvic pain remains a challenging condition to treat, in large part because underlying disease mechanisms are poorly understood.

Endometriosis-associated pelvic pain (EAPP) is a common form of CPP wherein the severity of disease is only weakly associated with the degree of pain experienced.

While pelvic inflammation is a well-established contributing factor to EAPP, we propose that low-grade systemic inflammation also contributes to the disease state by promoting central nervous system (CNS) sensitization.

Emerging evidence from our group and others suggests that low-grade systemic inflammation can promote multiple aspects of CNS sensitization including clinical manifestations (comorbid pain conditions, widespread pain), hypersensitivity to experimental stimuli, and altered brain functional connectivity in pelvic pain.

While hormonal suppression is effective for many women, and acts in part by dampening estradiol-dependent pelvic inflammation, little is known about the relative contributions of low-grade systemic inflammation and CNS sensitization to EAPP.

We propose to use the FDA-approved, gonadotropin releasing hormone receptor antagonist, elagolix, available in two dosages, as a mechanistic probe to assess the effects of pelvic and systemic inflammation on EAPP.

The presence of robust dose-dependent effects on EAPP and its comorbid symptoms suggests to us that the higher dose also reduces CNS sensitization, possibly due to reduced systemic inflammation.",general,semantic_chunk,,,206,5R01HD108253-02,The impact of hormonal modulation on systemic inflammation and central sensitization,2024,,False,0.0,phase2_nih,,5R01HD108253-02_chunk115,False,False,False
"To investigate this hypothesis, we will conduct a double-blind, placebo controlled randomized clinical trial in which 200 women with EAPP will be randomly assigned to low-dose (150mg daily) or high-dose (400mg daily) elagolix or placebo with evaluation of pain mechanism outcomes prior to and after treatment.

We will focus on two common patient phenotypes – those with EAPP only and those with EAPP and widespread pain (1:1 recruitment).

In Aim 1, we will first define the relationship between pelvic inflammation, systemic inflammation, and CNS sensitization using well-vetted neurobiological measures of CNS sensitization.

We anticipate that systemic inflammation will be associated with CNS sensitization, while pelvic inflammation will not be.

In Aim 2, we will identify dose-dependent changes in CNS sensitization as well as systemic and pelvic inflammation during hormonal suppression for EAPP through the above-described clinical trial.

We anticipate that both dosages will improve pelvic inflammation, but that systemic inflammation and CNS sensitization will be improved on high-dose elagolix.

We furthermore anticipate that those with widespread pain will be more likely to respond to high-dose elagolix.

In an exploratory Aim 3, we will determine if baseline levels of pelvic and/or systemic inflammatory activity, as well as CNS sensitization, predict the response to elagolix.

These studies are critical to develop alternative mechanistic models of pain promotion and relief in this vulnerable group of patients and will have implications for understanding hormonal contributions to the female preponderance of chronic pain syndromes.",results,semantic_chunk,,,239,5R01HD108253-02,The impact of hormonal modulation on systemic inflammation and central sensitization,2024,,False,0.0,phase2_nih,,5R01HD108253-02_chunk116,False,True,False
"Traumatic brain injury (TBI) is a leading health concern for both children and adults worldwide. Similarities between pig and human brain anatomy, development, and neuroinflammatory response have brought attention to the domestic pig as a highly promising model animal for studying age-specific responses to mechanical trauma. To date, I have quantified baseline behavioral data in healthy Yucatan minipigs. For the duration of the training period, I will conduct a battery of behavioral tests to identify changes in behavior and physiology in juvenile pigs following a closed-head impact procedure designed to model pediatric concussion. In the postdoctoral phase, I plan to develop expertise in the development of novel neurointervention strategies in large animal models. To facilitate transition to a lab where I will need to utilize state-of-the-art imaging techniques to validate the efficacy of my treatments, I will use magnetic resonance imaging (MRI) as an assessment tool to quantify changes in neural structure and function in brain-injured pigs. I will receive comprehensive training in MRI data processing from experts in both human and pig neuroradiology. The proposed training plan is specifically crafted to prepare me, Alesa Netzley, for a fulfilling and distinguished career as a large animal systems and translational neuroscientist.",methods,semantic_chunk,,,200,4K00NS129171-03,Assessing the efficacy of NIR therapy to modulate shared secondary injury mechanisms in a murine model of ischemic stroke and porcine model of TBI,2024,,False,0.0,phase2_nih,,4K00NS129171-03_chunk117,False,False,True
"approaches using mouse models, cell lines, and human islets, we will test the following Aims: (1) Demonstrate the pathophysiological importance of the interplay between ERAD and autophagy in α cells, and (2) Delineate the molecular mechanism underlying the crosstalk between ERAD and autophagy in α cells. This study will provide unprecedented insights into ER QC mechanisms in α cells, which may be harnessed to identify new therapeutic",section,approach,1632.0,2070.0,67,5K08DK129719-03,Coordinated functions of ER quality control mechanisms in pancreatic islet α cells,2023,,False,0.0,phase2_nih,,5K08DK129719-03_chunk118,,,
"approaches to address α cell dysfunction in diabetes. This undertaking will build upon Dr. Reinert’s scientific expertise in developmental biology and physiology with training in two cutting-edge cell biology fields, ERAD and autophagy, with a focus on organelle crosstalk. Moreover, this study will strengthen Dr. Reinert’s technical skills by providing training in state-of-the-art cell biology techniques, thus paving a strong foundation for her future career as a physician scientist leading an interdisciplinary team studying islet cell biology and pathophysiology. This career development award will be overseen by three outstanding scientists and mentors Drs. Ling Qi, Peter Arvan, and Jiandie Lin at the University of Michigan.",section,approach,2070.0,2805.0,105,5K08DK129719-03,Coordinated functions of ER quality control mechanisms in pancreatic islet α cells,2023,,False,0.0,phase2_nih,,5K08DK129719-03_chunk119,,,
"Glioblastoma (GBM) is the most common aggressive primary brain tumor and is uniformly fatal with a median survival of around 1.5 years.

Like surgery and chemotherapy, radiation (RT) is a critical treatment for nearly every patient with GBM and has repeatedly improved patient survival in multiple randomized trials.

Still, 80% of GBMs recur within the high dose RT field.

Thus, there is a critical need to develop strategies to overcome GBM RT resistance to further improve patient outcomes.

GBM cells exhibit profound cancer-specific metabolic abnormalities, including elevated purine synthesis, to fuel proliferation, invasion and survival.

Using mice bearing intracranial orthotopic patient-derived brain tumors, my research has established that the metabolic phenotype of elevated purine synthesis also mediates resistance to RT in GBM by promoting the repair of RT-induced DNA damage.

This purine-mediated RT resistance can be overcome by treatment with mycophenolate mofetil (MMF), an FDA-approved and CNS-penetrant inhibitor of purine biosynthesis.

In this research proposal I will determine how the RT response and purine synthesis regulate one another in GBM.

By employing a variety of cutting-edge metabolomic techniques and patient-derived GBM models, I will 1) define the biosynthetic pathway GBMs use to generate purines, and 2) determine the RT response mechanism by which GBMs increase purine levels to resist RT-induced DNA damage.",results,semantic_chunk,,,212,5F32CA260735-03,Targeting purine biosynthesis to radiosensitize glioblastoma,2023,,False,0.0,phase2_nih,,5F32CA260735-03_chunk120,False,True,False
"Findings from the experiments proposed here will expand our understanding of how tumors modulate metabolism to promote therapeutic resistance, inform how to combine metabolic inhibitors with standard therapies, and lay the mechanistic groundwork for clinical trials at the University of Michigan that targeting purine biosynthesis to augment RT in GBM patients.",results,semantic_chunk,,,51,5F32CA260735-03,Targeting purine biosynthesis to radiosensitize glioblastoma,2023,,False,0.0,phase2_nih,,5F32CA260735-03_chunk121,False,False,False
"methods. As the prevalence of type 2 diabetes and the understanding of personalized interventions continue to increase, there is a critical need to provide additional effective options for population-level type 2 diabetes prevention strategies. If the VLC-DPP shows promise, this trial would be a precursor to a multi-site trial with incidence of type 2 diabetes as the primary outcome.",section,methods,2634.0,3020.0,59,5R01DK125792-03,Testing a very low-carbohydrate diet version of the Diabetes Prevention Program to reduce risk factors for type 2 diabetes,2023,,False,0.0,phase2_nih,,5R01DK125792-03_chunk122,,,
"background clearly plays a role, environmental factors, especially dietary nutrients, have been suspected as triggers to contribute to the disease development. Identifying the direct causal mechanisms by which genetics and dietary nutrients coordinately influence IBD susceptibility may provide direct utility in uncovering both how the disease develops and how it may be treated in the future. Although genetic factors appear to play relatively minor roles in IBD, there is one particular association of single nucleotide polymorphism (SNP) with IBD that showed up at the top of a recent genome-wide association screen in IBD: a common variant in the manganese transporter SLC39A8 (p.Ala391Thr). We and others have shown that this transporter is critical for the incorporation of manganese (Mn), a micronutrient required for many enzymatic activities. The SLC39A8 A391T variant was shown in vitro to have reduced Mn incorporating function, and we made similar observations independently. These revelations hint toward alterations in Mn levels caused by diet or genetics, as contributing factors for IBD. Yet, Mn deficiency has traditionally been rare in humans due to its various dietary sources. Mn is abundant in plant-based foods, including whole grains, rice, nuts, and leafy vegetables, whereas animal-based foods lack this nutrient. Recent epidemiological studies have revealed >40% reduction in dietary Mn consumption in the past 15 years due to a Western diet characterized by high intakes of red meats, high fat foods, and refined grains. This data is congruent with the increasing incidence of IBD, and it supports an inverse relationship between nutritional Mn levels and IBD patients. However, we still have not established if there is a causal role of Mn in IBD and the mechanism by which Mn contributes to IBD. This project will define functional insight into the roles of dietary Mn and SLC39A8 that maintain intestinal health, thereby advancing research into the etiology of IBD. Our findings will pave the way for future research in individuals at high risk of IBD to provide dietary recommendations and therapeutic targets.",section,background,212.0,2354.0,329,5R01DK123022-04,Manganese in Inflammatory Bowel Disease,2023,,False,0.0,phase2_nih,,5R01DK123022-04_chunk123,,,
"results show that IL33 abundance correlates with disease progression and that fibroblast expression of IL33 is dependent on oncogenic Kras-driven signals from tumor cells. Additionally, we have completed a pilot experiment whereby we have orthotopically implanted pancreatic tumor cells into a syngeneic genetically engineered mouse model lacking Il33 in fibroblasts (Il33f/f, Pdgfra-CreERT2/+). Tumors from Il33-deficient mice had slower tumor growth and a trending decrease in macrophage infiltration, suggesting that fibroblast-derived Il33 is both tumor promoting and may play a role in the recruitment of immunosuppressive macrophages. Therefore, the overall objective of this study is to elucidate the cellular interactions that contribute to the establishment and maintenance of immunosuppression in PDA, and the central hypothesis is that fibroblast derived IL33 is a key regulator of immunosuppression in the pancreatic tumor microenvironment through its modulation of macrophage infiltration. This hypothesis will be investigated through the following two Aims: (Aim 1) define the regulation and role of IL33 in cancer-associated fibroblasts, and (Aim 2) assess the impact of IL33 on the recruitment of tumor-associated macrophages. To complete this investigation, a combination of in vitro assays using tumor cell, fibroblast, and macrophage cultures will be performed. We also will continue to utilize the Il33f/f, Pdgfra-CreERT2/+ genetically engineered mouse model to assess Il33-dependent changes in the immunosuppressive nature of pancreatic tumors. The data accumulated by this study will further the field’s understanding of immunosuppression regulation in PDA, and consequentially bring effective immunotherapy strategies one step closer to becoming a viable therapeutic option.",section,results,1384.0,3181.0,247,5F31CA265085-02,Regulation and role of fibroblast-derived interleukin-33 in the pancreatic tumor microenvironment,2023,,False,0.0,phase2_nih,,5F31CA265085-02_chunk124,,,
"research methods and the responsible conduct of research, and collaborations with colleagues with complementary expertise and educational commitments. Each candidate will have a tailored timeline towards career advancement, including the regular publication of original research manuscripts. Dr. Dickson will provide mentorship not only in",section,methods,1447.0,1787.0,44,5K24HL159247-02,Midcareer Investigator Award in Patient-Oriented Research in the Microbiome and Lung Disease,2023,,False,0.0,phase2_nih,,5K24HL159247-02_chunk125,,,
"methodologic expertise but also in the critical skills of scientific communication and leadership. Dr. Dickson’s scientific aims for this project will extend his existing research into a new area of immediate patient-oriented importance: the role of the microbiome in viral respiratory infections. The first aim will be to determine if respiratory and gut bacteria (characterized via pharyngeal swabs, rectal swabs, and by the diversity and burden of gut bacterial DNA detectable in blood specimens) explains patient heterogeneity in susceptibility to severe COVID-19 disease. The second aim will be to determine how acute influenza infection and vaccination (administered in a controlled experiment of healthy volunteers) alters upper respiratory tract microbiota, and how this explains variation in systemic immune response. These aims leverage 1) existing biospecimens already available to Dr. Dickson, 2) a unique controlled experimental human model of acute influenza infection, and 3) Dr. Dickson’s broad research portfolio characterizing the role of microbiota (both respiratory and gut) in the pathogenesis of critical illness. Dr. Dickson is at an ideal stage of his career to take advantage of a K24 award, and is deeply committed to an investigative career in patient-oriented research as well as developing the next generation of investigators.",section,methods,1787.0,3143.0,199,5K24HL159247-02,Midcareer Investigator Award in Patient-Oriented Research in the Microbiome and Lung Disease,2023,,False,0.0,phase2_nih,,5K24HL159247-02_chunk126,,,
Specific Aim 1 will determine the parameters of noise that causes temporary versus permanent changes to the VsEP and to peripheral vestibular nerve terminals and their synapses in the saccular and utricular maculae.,section,specific_aims,2136.0,2352.0,33,5R01DC018003-04,Noise-Induced Synaptic Loss and Vestibular Dysfunction,2023,,False,0.0,phase2_nih,,5R01DC018003-04_chunk127,,,
Specific Aim 2 will extend the analysis of Aim 1 to examine the semicircular canal cristae and compare noise-induced changes in the cristae with those observed in the otolith organs.,section,specific_aims,2352.0,2535.0,30,5R01DC018003-04,Noise-Induced Synaptic Loss and Vestibular Dysfunction,2023,,False,0.0,phase2_nih,,5R01DC018003-04_chunk128,,,
"Specific Aim 3 will correlate changes in VsEP responses and noise induced synaptic pathology with behavioral assays: a beam crossing task, an otolith dependent behavior (macular ocular reflex, MOR), and a semicircular canal dependent behavior (vestibuloocular reflex, VOR).",section,specific_aims,2535.0,2808.0,38,5R01DC018003-04,Noise-Induced Synaptic Loss and Vestibular Dysfunction,2023,,False,0.0,phase2_nih,,5R01DC018003-04_chunk129,,,
"This study directly responds to NIMHD Program Announcement for Health Services Research on Minority Health and Health Disparities (PAR-20-310).

Perinatal mood and anxiety disorders (PMAD), which include depression and/or anxiety in the year before and/or after delivery, are common complications of pregnancy, affecting up to one in four women, with costs over $15 billion per year in the US.

PMAD can negatively affect mothers, babies, and families beyond the perinatal period, and have lasting clinical and economic effects.

PMAD treatment can improve maternal and neonatal health outcomes, yet mental health services are rarely used.

No comprehensive data source documents the: 1) magnitude, 2) predictors, and 3) variation in disparities by race and ethnicity, socioeconomic status, and geography in healthcare utilization or obstetric delivery outcomes among women with PMAD.

Almost no evidence documents the impact of community characteristics on these outcomes.

There is no national plan for how best to address PMAD, overall, or within high-risk subgroups.",results,semantic_chunk,,,156,5R01MD014958-03,Disparities in utilization and delivery outcomes for women with perinatal mood and anxiety disorders (PMAD): groundwork for state policymaking,2023,,False,0.0,phase2_nih,,5R01MD014958-03_chunk130,False,True,False
"Using data from publicly (Medicaid) and privately (Optum) insured women with PMAD, state survey data, input from a panel of perinatal mental health services and policy experts, and interviews with state maternal and infant health (MIH) and MH policy makers, we will: 1) identify patient-level clinical characteristics associated with MH and overall perinatal utilization and delivery-related outcomes among women with diagnosed PMAD, and establish accurate national and state-level estimates of disparities in care patterns and outcomes, including MH utilization, overall utilization, and delivery-outcomes; 2) determine contributions of community-level characteristics to perinatal utilization and delivery outcomes among women with PMAD using data from Pregnancy Risk Assessment Monitoring System (PRAMS), Area Health Resource File (AHRF), and National Mental Health Services Survey (N-MHSS); and 3) collaborate with an expert panel to develop an evidence-based policymaking guide for PMAD, which we will use to interview state maternal and infant health and mental health policy officials.

Using Aim 1-2 findings and expert panel input, we will develop an EBP guide for PMAD.

This guide will provide structure for interviews with state maternal and infant health and mental health policy officials from states with high and low relative performance on PMAD treatment and outcomes to help interpret quantitative findings, tailor recommendations, and assist in future PMAD policymaking initiatives.",results,semantic_chunk,,,212,5R01MD014958-03,Disparities in utilization and delivery outcomes for women with perinatal mood and anxiety disorders (PMAD): groundwork for state policymaking,2023,,False,0.0,phase2_nih,,5R01MD014958-03_chunk131,False,True,False
"Given the dearth of research on disparities in addressing PMAD and associated utilization and delivery outcomes, and the high, inter-generational costs for mother and baby of ineffectively managed PMAD, this innovative, large-scale investigation will provide evidence for future policymaking and clinical interventions.

Our findings and policy guidance could address disparities in outcomes for high cost, high risk subpopulations.",results,semantic_chunk,,,58,5R01MD014958-03,Disparities in utilization and delivery outcomes for women with perinatal mood and anxiety disorders (PMAD): groundwork for state policymaking,2023,,False,0.0,phase2_nih,,5R01MD014958-03_chunk132,False,True,True
"methods to assist high risk individuals in attaining both the weight management and diet quality goals for colorectal cancer (CRC) prevention. Existing recruitment plans for this study mainly rely on clinic-based recruitment and research registries, strategies which have yielded largely well-educated, white study populations in our prior work. Here, we propose",section,methods,157.0,520.0,51,3R01CA255743-02S1,MyGI Diet for Colorectal Cancer Prevention,2023,,False,0.0,phase2_nih,,3R01CA255743-02S1_chunk133,,,
