text,chunk_type,section_name,start_pos,end_pos,word_count,grant_id,document_title,year,institute,is_fqhc_focused,fqhc_score,data_source,primary_condition,chunk_id,contains_methods,contains_outcomes,contains_innovation
"research methodology, responsible conduct of research, and career development. To learn presentation skills and principles of rigor and reproducibility, students will co- lead, with a research mentor, journal clubs and works-in-progress sessions. Additional novel aspects of the program include use of peer-to-peer mentoring and ongoing exposure to successful early career physician- scientists. At the end of the summer, students will present at a SRTP Research Symposium and the COM Research Day. After the program is completed, the program will utilize multiple strategies to facilitate continued involvement in research activities, including encouraging students to apply to the James Scholar Program, a program that provides the infrastructure to support research during the second to fourth years of medical school. In addition, the program will strive to create a sense of community among SRTP cohorts by hosting quarterly “Ideas on Tap” (research/social networking events at which students present ongoing research), and will maintain connections with trainees using the program website, newsletters, an SRTP Slack communication channel, and social media. An Executive Committee will oversee implementation of the program, recruitment/selection, program evaluation, and tracking of short- and long-term outcomes. Strengths of the program include the experienced co-Directors, committed and well-funded program mentors with broad expertise across NIDDK mission areas, an innovative structured curriculum, a robust recruitment plan to enhance diversity, strong institutional support, and a thoughtfully conceived plan to foster continued research involvement after program completion. Consequently, the proposed SRTP will provide medical students with a substantive research experience, facilitating the achievement of the long-term objective of increasing the pipeline and diversity of physicians entering the research workforce in NIDDK mission areas.",section,methods,1243.0,3202.0,268,5T35DK131960-03,Short-Term Research Training Program in NIDDK Mission Areas,2024,,False,0.0,phase2_nih,,5T35DK131960-03_chunk0,,,
"METHODS: The R61 phase (1 year) will focus on finalizing trial planning and preparation and begin early enrollment; in the R33 phase (4 years) we will conduct a 2-arm randomized clinical trial over 12 months. Adults with uncontrolled asthma (n=320) on standard controller therapy will be equally randomized and assessed at baseline (0), 3, 6 and 12 months. The control and intervention groups will be matched on the number, frequency, and format of sessions over 12 months while the length of each session is proportional to the content delivered. Control participants will receive education on lung health, asthma, and other general health topics using American Lung Association and UpToDate materials. The intervention group will receive the same health education and materials in addition to DASH behavioral counseling. Central hypothesis: Compared with the education-only control, the DASH behavioral intervention will lead to significantly more participants with a clinically significant improvement (responders) in asthma-specific quality of life (primary outcome) and significantly greater improvements in related asthma and non-asthma outcomes, which will be mechanistically linked to improved diet quality.",section,methods,1019.0,2235.0,176,5R33HL155160-04,"The ALOHA trial: Addressing Quality of Life, Clinical Outcomes, and Mechanisms in Uncontrolled Asthma Following the DASH Dietary Pattern",2024,,False,0.0,phase2_nih,,5R33HL155160-04_chunk1,,,
"SPECIFIC AIMS: First, to determine intervention efficacy on the primary outcome of clinically significant improvement in asthma-specific quality of life at 12 months and secondary outcomes (asthma control, lung function, generic qualify of life, blood pressure, mental health, sleep health). Second, to examine the intervention effects on metabolomic (circulating short-chain fatty acids: propionate, butyrate, acetate), immune response (interferon-gamma, IL-5, IL-17A, IL-10, IL-1β, IL-6, IL-8, TNFα), and physiologic (bronchodilator responsiveness) biomarkers of asthma. Third, to examine the intervention effects on self- reported and objective indices of diet quality (DASH score, dietary inflammatory index, serum carotenoids). We also will conduct exploratory analyses of causal mediation linking diet quality, biomarkers, and asthma outcomes as well as effect modification by sex and other biological variables (age of asthma onset, atopy). IMPACT: This trial has high potential to advance the clinical and mechanistic understandings of diet quality in asthma.",section,specific_aims,2235.0,3302.0,144,5R33HL155160-04,"The ALOHA trial: Addressing Quality of Life, Clinical Outcomes, and Mechanisms in Uncontrolled Asthma Following the DASH Dietary Pattern",2024,,False,0.0,phase2_nih,,5R33HL155160-04_chunk2,,,
"specific aims to test this hypothesis. In aim 1, we will test our preliminary data driven hypothesis that a subset of altered miRNAs in preconditioned MSC EVs contributes to the enhanced immunomodulatory function of the inflammatory preconditioned MSC derived EVs. We will also generate engineered MSC EVs that overexpress candidate miRNA with anti-inflammatory properties to further study the mechanistic aspects by which individual EV related miRNAs control the immunomodulation functionality. In aim 2, we will create a novel dual delivery system with LZ-hydrogels and alginate beads that contain engineered EVs and rhBMP2 respectively. We will test our hypothesis that 1) EVs with anti-inflammatory properties (generated from aim 1) can be released during the inflammatory phase of healing (up to 7 days) from a self-assembling LZ- hydrogel and 2) rhBMP2 that is encapsulated in alginate beads with an extended-release profile (4-6 weeks) can provide a long term osteoinductive signal to promote/enhance bone regeneration. In aim 3, using a diabetic mouse calvarial defect model, we will test the hypothesis that engineered MSC EVs containing anti-inflammatory miRNA will suppress inflammation upon wounding while sustained released rhBMP2 promote bone healing. Overall, the",section,specific_aims,1277.0,2556.0,188,5R01DE033167-02,Dual Delivery of Engineered EVs and Growth Factor for Bone Regeneration,2024,,False,0.0,phase2_nih,,5R01DE033167-02_chunk3,,,
"results of these first studies of the combinatorial usage of engineered and MSC EVs rhBMP2 will provide a foundation for continued definition of MSC EV-mediated immunomodulation, and the regenerative properties and applicability of the dual delivery system to bone healing in T2DM. Further, these studies will also provide a framework for the use of growth factors and engineered EVs in combination for tissue engineering applications.",section,results,2556.0,2991.0,65,5R01DE033167-02,Dual Delivery of Engineered EVs and Growth Factor for Bone Regeneration,2024,,False,0.0,phase2_nih,,5R01DE033167-02_chunk4,,,
"This is an application to the Countermeasures Against Chemical Threats (CounterACT) NIH-wide program part of the Chemical Countermeasures Research Program. Sulfur mustard (SM), a chemical warfare agent, and nitrogen mustard (NM), a chemotherapeutic agent, are both potent vesicants. The cornea is exquisitely sensitive to these agents leading to keratitis, vascularization, ulceration, and perforations. Following acute SM exposure, a subset of patients will experience chronic/delayed-onset ocular complications known as mustard gas keratopathy (MGK). Delayed MGK reportedly can manifest several years after the initial exposure and presents with severe corneal disease with significant visual loss. We have made the observation that in experimental animal models of NM injury to the cornea, there is dose-dependent increased senescence in the cornea. We hypothesize that senescence in the cornea promotes tissue dysfunction and inflammationand that senescence after mustard injury contributes to the progression of chronic MGK and the severity of delayed MGK. We further hypothesize that reducing/eliminating senescent cells may alter the progression and severity of MGK. In this application we propose in Aim1 to investigate the role of senescence and SASP in the progression of corneal disease following acute exposure to NM; and in Aim 2 to investigate the role of senescence in a new model of delayed MGK. At the conclusion of these studies, we expect to have an improved understanding of the role of senescence in the development of MGK and identify novel approaches for its prevention/treatment.",methods,semantic_chunk,,,235,1R01EY035221-01A1,Pathophysiology of Chronic and Delayed Mustard Gas Keratopathy,2024,,False,0.0,phase2_nih,,1R01EY035221-01A1_chunk5,True,False,True
"methods that consider individual differences in cyclical hormone sensitivity and sleep patterns; 3) Experimental ovarian hormone manipulation to establish causality in the relationship between sleep disturbances, cycling hormones, and suicidality/depression. The proposed project will provide clinical trial research experience, training in nomothetic and idiographic statistical modeling, and collaborative mentorship in",section,methods,2249.0,2671.0,50,1F30MH138058-01,Sleep as a Mechanism of Premenstrual Exacerbation of Depression and Suicidality,2024,,False,0.0,phase2_nih,,1F30MH138058-01_chunk6,,,
methods and clinical exposure in sleep and reproductive psychiatry to help the candidate achieve long-term career goals in academic medicine.,section,methods,2671.0,2812.0,20,1F30MH138058-01,Sleep as a Mechanism of Premenstrual Exacerbation of Depression and Suicidality,2024,,False,0.0,phase2_nih,,1F30MH138058-01_chunk7,,,
"PROJECT ABSTRACT The inflammatory cell death program pyroptosis occurs in a wide range of cell types and plays important roles in development, tissue injury, and tumor growth. Curiously, unlike other cell death mechanisms, cells frequently survive pyroptosis activation. The persistence of a family of “inefficient” cell death genes is puzzling and suggests they may have other roles. Intuitively, cells that survive the inflammatory insult will dictate both the short-term adaptation and long-term repair and regeneration afterwards. Therefore, a flawed death program may actually be a “trial”. However, the details of cell survival after pyroptosis and the biochemical circuitry beyond its activation are under-studied, hindering our basic understanding. In this Program, we hypothesize that cell death is a side- effect of pyroptosis, which in fact aims to reprogram cell functions. To explore the new concept that “trial-by-fire” provides strong evolutionary advantages, we will investigate 1) whether it is possible to stop/resume pyroptosis and the basic mechanisms used to exert such control; 2) the capacity and limits of pyroptosis signaling; and 3) the single cell phenotypic effects of weathering pyroptosis. In pursuing this central hypothesis, we will discover new cell signaling circuits and simultaneously enhance the field’s ability to detect novel pathways by developing new genetically encoded tools, imaging algorithms, and bioinformatics",section,abstract,48.0,1506.0,210,5R35GM146936-03,Pyroptosis is a Trial-by-Fire Program,2024,,False,0.0,phase2_nih,,5R35GM146936-03_chunk8,,,
methods. The Program aims to construct a new perspective that the salient function of pyroptosis is to prime and educate through a near-death experience.,section,methods,1506.0,1659.0,24,5R35GM146936-03,Pyroptosis is a Trial-by-Fire Program,2024,,False,0.0,phase2_nih,,5R35GM146936-03_chunk9,,,
"specific aims. In Aim 1, I will conduct secondary analyses of baseline data from a large HIV prevention intervention involving SA-AGYW and their female caregivers (IMARA-SA). Analyses of 642 AGYW will examine mental health distress, IPV, and AGYW-caregiver warmth and communication as drivers of AGYW sexually transmitted infections, including HIV. Preliminary data from the parent study revealed high rates mental health distress and IPV. I hypothesize that increased warmth and communication between AGYW and female caregivers will decrease the association between mental health distress and sexual risk behaviors even in the presence of IPV. In Aim 2, I will supplement the quantitative analysis with 20- 30 qualitative interviews with SA-AGYW with experiences of IPV. I will purposively select participants from the parent study who have completed the 12-month follow up and reported IPV. Interviews will offer new insight into the impact of female caregiver communication about addressing experiences of IPV and sexual risk behavior. The findings from aims 1 and 2 will inform interventions to improve the SA-AGYW mental health, lessen IPV exposure, and strengthen sexual and reproductive health. Mentorship provided by an experienced team with a long history of collaboration will ensure excellent training, extensive opportunities to publish in high impact journals and present at international scientific conferences, and exposure to colleagues through networking. This F30 fellowship will provide a well-rounded education that empowers me to become a physician-scientist with a program of research focused on AGYW sexual and reproductive health.",section,specific_aims,1388.0,3042.0,242,1F30HD116496-01,Investigation of Social and Behavioral Drivers of HIV Risk Among South African Adolescent Girls and Young Women,2024,,False,0.0,phase2_nih,,1F30HD116496-01_chunk10,,,
"The development of type II diabetes (T2D) is strongly associated with obesity, and both are well-established risk factors for cardiovascular disease.

Vascular dysfunction is an early event in developing cardiovascular disease in obese diabetic (OB-T2D) patients.

Therefore, we set our long-term goal to define molecular mechanisms of vascular dysfunction and corrective strategies that target these mechanisms, such as physical activity and weight loss.

We recently discovered that human adipose tissues release extracellular vesicles (adiposomes) that are efficiently captured by endothelial cells.

Adiposomes are known to carry bioactive cargos such as proteins and micro RNAs; however, their lipid content has not been studied, neither their ability to transfer their lipid cargo to endothelial cells.

In the current application, we propose investigating the role of adiposomes in communicating the unhealthy milieu, mainly dysregulated lipids, to endothelial cells in OB-T2D subjects.

On top of these lipid species that we propose to be carried by adiposomes are glycosphingolipids (GSLs).

GSLs originate from ceramide glycosylation, a chemical process that is upregulated in the presence of inflammation and high glucose levels.

Our preliminary findings showed that in endothelial cells, GSL-rich adiposomes disturb plasma membrane structure and subsequently induces endothelial dysfunction.

Moreover, we found preconditioning endothelial cells with high shear stress (which is an exercise mimetic) protected endothelial cells from the detrimental effects caused by adiposomes.

Therefore, our central hypothesis is that adipose tissues in OB-T2D patients release GSL-loaded adiposomes that induce vascular endothelial dysfunction.",results,semantic_chunk,,,238,5R01HL161386-03,Role of Adiposomes in Diabetes-Associated Endothelial Dysfunction and Restorative Effects of Exercise and Metabolic Surgery,2024,,False,0.0,phase2_nih,,5R01HL161386-03_chunk11,False,False,False
"We propose that exercise and weight loss interventions (bariatric surgery) will restore adipose tissue homeostasis, reduce GSL-loaded adiposomes, and subsequently alleviate vascular risk in OB-T2D patients.

We will test our hypotheses by pursuing the following Aims: Aim 1: Investigate the role of GSL-rich adiposomes in the pathogenesis of endothelial dysfunction in OB- T2D adults; Aim 2: Test the effectiveness of exercise training in reducing adiposome-mediated effects on vascular function; and Aim 3: Examine changes in adiposome/caveolae axis following metabolic surgery and their association with vascular function.

This study will improve our mechanistic understanding of the biological underpinning of adiposome production, packaging, and role in inducing ED under conditions of obesity and T2D.

It will also identify adiposomes and the proposed mechanisms of their interaction with endothelial cells as novel therapeutic targets for improving vascular function in OB-T2D individuals.

Once these pathways are elucidated, strategies for targeting them can be advanced, leading to an improved therapeutic management of T2D-related cardiovascular disease.",aims,semantic_chunk,,,160,5R01HL161386-03,Role of Adiposomes in Diabetes-Associated Endothelial Dysfunction and Restorative Effects of Exercise and Metabolic Surgery,2024,,False,0.0,phase2_nih,,5R01HL161386-03_chunk12,False,False,True
"ABSTRACT Lung failure from endotoxemia and sepsis induces widespread and often rapid lung vascular endothelial injury due to unfettered influx of inflammatory cells such as neutrophils and macrophages. This maladaptive inflammatory response outpaces the reparative capacity of lungs,",section,abstract,18.0,302.0,38,5R01HL152515-04,Amplification Mechanisms of Lung Endothelial Inflammation During Acute Lung Injury,2024,,False,0.0,phase2_nih,,5R01HL152515-04_chunk13,,,
"resulting in profound inflammatory lung injury and hypoxemia. This proposal focuses on fundamental amplification mechanisms underlying the maladaptive inflammatory activation of the lung endothelium. Our central hypothesis is that the inflammatory response to threat signals such as the initial breaching of the endothelial plasma membrane by bacterial lipopolysaccharide (LPS) and rapid release of mitochondrial DNA by the injured mitochondria into the cytosol massively and acutely amplifies the inflammatory response and thus serves as essential feed-forward mechanisms for progression of acute lung injury (ALI). In Aim 1, we will determine the mechanisms by which the recently identified perforin Gasdermin D mediates endothelial plasma membrane pore formation and the mechanisms of activation of the K+ efflux ion channel TWIK2 that we have recently identified. We will address the role of amplifying K+ efflux on the severity and rapidity of endothelial NLRP3 inflammasome activation and fulminant lung injury. In Aim 2, we will define another crucial amplification mechanism, the potentially important role of Gasdermin D-mediated mitochondrial (mt) membrane pore formation and the release of mtDNA, which may also catastrophically amplifiy lung injury via activation of Type I interferon signaling. These mechanistically driven studies will utilize genetic mouse models (endothelial specific knockout models in our labs) as well as comprehensive imaging, electrophysiological and physiological",section,results,302.0,1805.0,210,5R01HL152515-04,Amplification Mechanisms of Lung Endothelial Inflammation During Acute Lung Injury,2024,,False,0.0,phase2_nih,,5R01HL152515-04_chunk14,,,
approaches and thus provide the framework for identifying novel endothelial amplification inflammatory mechanisms that induce lung vascular injury and ALI. We will elucidate how these pathways can be targeted to reduce tissue damage and improve survival.,section,approach,1805.0,2059.0,36,5R01HL152515-04,Amplification Mechanisms of Lung Endothelial Inflammation During Acute Lung Injury,2024,,False,0.0,phase2_nih,,5R01HL152515-04_chunk15,,,
"approach to establish accurate counts of all individuals within census tracts with sociodemographic, behavioral, and neighborhood risk profiles. The strength of RECODE is its innovative",section,approach,2546.0,2732.0,25,5R01MD014839-04,Reducing racial disparities in lung cancer outcomes by decoding neighborhood contextual environment (RECODE),2024,,False,0.0,phase2_nih,,5R01MD014839-04_chunk16,,,
approach to unveil a social epigenetic mechanism of lung cancer disparity. RECODE has the potential to transform understanding multilevel risks of lung cancer and improve the national lung cancer screening guidelines to reflect the social conditions of racial minority communities.,section,approach,2732.0,3013.0,40,5R01MD014839-04,Reducing racial disparities in lung cancer outcomes by decoding neighborhood contextual environment (RECODE),2024,,False,0.0,phase2_nih,,5R01MD014839-04_chunk17,,,
"results are supported by strong in vivo murine data that suggests antiviral efficacy and topical dosage safety of Na-PBA. Due to the high sodium burden associated with Na-PBA administration, its unpalatability, and inability to penetrate sufficiently through corneal epithelium upon topical administration, we have developed various sodium-free PBA nanoformulations to overcome limitations associated with oral and topical delivery of Na-PBA. The purpose of this R24 application is to generate preclinical data in two animal models that support an IND application for repurposing PBA to treat ocular HSV infection. This will be achieved via 3 well thought, exhaustive",section,results,1256.0,1924.0,97,5R24EY033598-03,Alleviation of ER stress as a translational strategy to curb ocular viral infections,2024,,False,0.0,phase2_nih,,5R24EY033598-03_chunk18,,,
"specific aims. In the first aim, we will evaluate dose-dependent pharmacokinetics, and safety of orally and topically delivered Na-PBA solution and various sodium-free PBA nanoformulations. Furthermore, we will also determine oral and topical, and oral antiviral efficacy of Na-PBA and sodium-free PBA nanoformulations in murine models of ocular HSV-1 infection. The second aim will use the most effective oral and topical formulation(s) and test their safety, PK, and efficacy in guinea pig and rabbit models of primary and reactivated ocular HSV-1 infection. Finally aim 3, we will investigate the potential of Na-PBA and sodium-free PBA formulations to synergize with existing antiviral therapies to determine their potential as an add-on modality to the existing treatment. The latter is likely and significant since PBA is a rare drug that works via alleviating ER stress and aiding the host cell’s response to viral infection, and thereby reducing the chance for emergence of viral resistance. We have assembled a multidisciplinary team including scientists, clinicians, drug development and translation experts who can help us navigate through requisite FDA guidelines. PBA has the potential to become a safe and efficacious alternative to existing ocular antivirals very quickly.",section,specific_aims,1924.0,3211.0,191,5R24EY033598-03,Alleviation of ER stress as a translational strategy to curb ocular viral infections,2024,,False,0.0,phase2_nih,,5R24EY033598-03_chunk19,,,
"methods such as chemogenetics and CRISPR technology, we anticipate achieving the following goals: 1) to reveal novel epigenetic marks and changes in gene expression associated with chronic alcohol exposure and withdrawal with whole genome",section,methods,1629.0,1868.0,34,5P50AA022538-10,Epigenetic Mechanisms of Positive  Affective State of AUD,2024,,False,0.0,phase2_nih,,5P50AA022538-10_chunk20,,,
"approaches, 2) to examine whether decreased histone acetylation and increased histone methylation reduce expression of cholesterol synthesis enzymes in the VTA during withdrawal in a cell-type specific manner, and probe the role of cholesterol synthesis enzyme genes in withdrawal-related drinking behavior and GABA hyposensitivity, 3) to determine whether targeted epigenetic intervention counteracts withdrawal-induced phenotypes by using CRISPR to prevent decreases in histone acetylation on promoters of key cholesterol synthesis enzyme genes, and 4) to translate to post-mortem human alcoholic VTA the epigenetic dynamics and expression of genes related to GABA hyposensitivity that have been identified in the rat VTA. Ultimately, these studies are needed to understand epigenetic adaptation of VTA neurons involved in the positive affective state during alcohol withdrawal, and, with the other components of this Center, will provide a great deal of information on epigenetic mechanisms involved in withdrawal-induced brain changes, and possible pharmacological",section,approach,1868.0,2937.0,146,5P50AA022538-10,Epigenetic Mechanisms of Positive  Affective State of AUD,2024,,False,0.0,phase2_nih,,5P50AA022538-10_chunk21,,,
Results from these studies will reveal brain region-selective changes in genes that are likely to contribute to alcohol use disorders. The above studies constitute Aim 1 of the Core. Aim 2 proposes bioinformatics pipelines for the analyses of the genome-wide datasets and the 5hmC array and integrating the large datasets for both preclinical and post- mortem studies. The integration of datasets from multiple non-biased,section,results,1248.0,1670.0,64,5P50AA022538-10,Epigenetics  Core,2024,,False,0.0,phase2_nih,,5P50AA022538-10_chunk22,,,
